{
  "id": "delhi",
  "name": "Delhi NCR",
  "name_hi": "दिल्ली एनसीआर",
  "timezone": "Asia/Kolkata",
  "bounds": {"south": 28.38, "west": 76.83, "north": 28.89, "east": 77.48},
  "ref_elevation_m": null,
  "_note": "Centroids are approximate locality centres (about ±1 km), placed by hand. Elevations are filled by scripts/fill_elevation.py from the Open-Meteo elevation API; ref_elevation_m is the median cell elevation.",
  "cells": [
    {"id": "narela", "name": "Narela", "name_hi": "नरेला", "lat": 28.853, "lon": 77.093, "elevation_m": null},
    {"id": "bawana", "name": "Bawana", "name_hi": "बवाना", "lat": 28.8, "lon": 77.035, "elevation_m": null},
    {"id": "alipur", "name": "Alipur", "name_hi": "अलीपुर", "lat": 28.797, "lon": 77.134, "elevation_m": null},
    {"id": "burari", "name": "Burari", "name_hi": "बुराड़ी", "lat": 28.754, "lon": 77.197, "elevation_m": null},
    {"id": "rohini", "name": "Rohini", "name_hi": "रोहिणी", "lat": 28.733, "lon": 77.113, "elevation_m": null},
    {"id": "pitampura", "name": "Pitampura", "name_hi": "पीतमपुरा", "lat": 28.703, "lon": 77.132, "elevation_m": null},
    {"id": "shalimar-bagh", "name": "Shalimar Bagh", "name_hi": "शालीमार बाग", "lat": 28.716, "lon": 77.158, "elevation_m": null},
    {"id": "jahangirpuri", "name": "Jahangirpuri", "name_hi": "जहांगीरपुरी", "lat": 28.729, "lon": 77.17, "elevation_m": null},
    {"id": "azadpur", "name": "Azadpur", "name_hi": "आज़ादपुर", "lat": 28.707, "lon": 77.178, "elevation_m": null},
    {"id": "model-town", "name": "Model Town", "name_hi": "मॉडल टाउन", "lat": 28.716, "lon": 77.191, "elevation_m": null},
    {"id": "north-campus", "name": "North Campus", "name_hi": "नॉर्थ कैंपस", "lat": 28.688, "lon": 77.21, "elevation_m": null},
    {"id": "civil-lines", "name": "Civil Lines", "name_hi": "सिविल लाइंस", "lat": 28.681, "lon": 77.226, "elevation_m": null},
    {"id": "chandni-chowk", "name": "Chandni Chowk", "name_hi": "चांदनी चौक", "lat": 28.656, "lon": 77.23, "elevation_m": null},
    {"id": "karol-bagh", "name": "Karol Bagh", "name_hi": "करोल बाग", "lat": 28.652, "lon": 77.19, "elevation_m": null},
    {"id": "connaught-place", "name": "Connaught Place", "name_hi": "कनॉट प्लेस", "lat": 28.632, "lon": 77.219, "elevation_m": null},
    {"id": "ito", "name": "ITO", "name_hi": "आईटीओ", "lat": 28.629, "lon": 77.241, "elevation_m": null},
    {"id": "india-gate", "name": "India Gate", "name_hi": "इंडिया गेट", "lat": 28.613, "lon": 77.229, "elevation_m": null},
    {"id": "lodhi-colony", "name": "Lodhi Colony", "name_hi": "लोधी कॉलोनी", "lat": 28.588, "lon": 77.224, "elevation_m": null},
    {"id": "karala-kanjhawla", "name": "Karala-Kanjhawla", "name_hi": "कराला-कंझावला", "lat": 28.727, "lon": 77.03, "elevation_m": null},
    {"id": "mangolpuri", "name": "Mangolpuri", "name_hi": "मंगोलपुरी", "lat": 28.693, "lon": 77.083, "elevation_m": null},
    {"id": "nangloi", "name": "Nangloi", "name_hi": "नांगलोई", "lat": 28.681, "lon": 77.064, "elevation_m": null},
    {"id": "paschim-vihar", "name": "Paschim Vihar", "name_hi": "पश्चिम विहार", "lat": 28.668, "lon": 77.102, "elevation_m": null},
    {"id": "punjabi-bagh", "name": "Punjabi Bagh", "name_hi": "पंजाबी बाग", "lat": 28.668, "lon": 77.131, "elevation_m": null},
    {"id": "zakhira", "name": "Zakhira", "name_hi": "ज़खीरा", "lat": 28.66, "lon": 77.147, "elevation_m": null},
    {"id": "rajouri-garden", "name": "Rajouri Garden", "name_hi": "राजौरी गार्डन", "lat": 28.649, "lon": 77.122, "elevation_m": null},
    {"id": "vikaspuri", "name": "Vikaspuri", "name_hi": "विकासपुरी", "lat": 28.64, "lon": 77.071, "elevation_m": null},
    {"id": "janakpuri", "name": "Janakpuri", "name_hi": "जनकपुरी", "lat": 28.621, "lon": 77.088, "elevation_m": null},
    {"id": "uttam-nagar", "name": "Uttam Nagar", "name_hi": "उत्तम नगर", "lat": 28.621, "lon": 77.055, "elevation_m": null},
    {"id": "najafgarh", "name": "Najafgarh", "name_hi": "नजफ़गढ़", "lat": 28.609, "lon": 76.98, "elevation_m": null},
    {"id": "dwarka", "name": "Dwarka", "name_hi": "द्वारका", "lat": 28.585, "lon": 77.045, "elevation_m": null},
    {"id": "palam", "name": "Palam", "name_hi": "पालम", "lat": 28.589, "lon": 77.084, "elevation_m": null},
    {"id": "dhaula-kuan", "name": "Dhaula Kuan", "name_hi": "धौला कुआं", "lat": 28.592, "lon": 77.162, "elevation_m": null},
    {"id": "chanakyapuri", "name": "Chanakyapuri", "name_hi": "चाणक्यपुरी", "lat": 28.597, "lon": 77.186, "elevation_m": null},
    {"id": "rk-puram", "name": "RK Puram", "name_hi": "आर के पुरम", "lat": 28.566, "lon": 77.176, "elevation_m": null},
    {"id": "vasant-kunj", "name": "Vasant Kunj", "name_hi": "वसंत कुंज", "lat": 28.52, "lon": 77.158, "elevation_m": null},
    {"id": "mehrauli", "name": "Mehrauli", "name_hi": "महरौली", "lat": 28.524, "lon": 77.185, "elevation_m": null},
    {"id": "chhatarpur", "name": "Chhatarpur", "name_hi": "छतरपुर", "lat": 28.498, "lon": 77.177, "elevation_m": null},
    {"id": "hauz-khas", "name": "Hauz Khas", "name_hi": "हौज़ ख़ास", "lat": 28.55, "lon": 77.2, "elevation_m": null},
    {"id": "saket", "name": "Saket", "name_hi": "साकेत", "lat": 28.524, "lon": 77.21, "elevation_m": null},
    {"id": "lajpat-nagar", "name": "Lajpat Nagar", "name_hi": "लाजपत नगर", "lat": 28.568, "lon": 77.243, "elevation_m": null},
    {"id": "nizamuddin", "name": "Nizamuddin", "name_hi": "निज़ामुद्दीन", "lat": 28.589, "lon": 77.25, "elevation_m": null},
    {"id": "kalkaji", "name": "Kalkaji", "name_hi": "कालकाजी", "lat": 28.54, "lon": 77.259, "elevation_m": null},
    {"id": "sangam-vihar", "name": "Sangam Vihar", "name_hi": "संगम विहार", "lat": 28.496, "lon": 77.244, "elevation_m": null},
    {"id": "tughlakabad", "name": "Tughlakabad", "name_hi": "तुगलकाबाद", "lat": 28.503, "lon": 77.261, "elevation_m": null},
    {"id": "okhla", "name": "Okhla", "name_hi": "ओखला", "lat": 28.531, "lon": 77.271, "elevation_m": null},
    {"id": "jamia-nagar", "name": "Jamia Nagar", "name_hi": "जामिया नगर", "lat": 28.562, "lon": 77.285, "elevation_m": null},
    {"id": "badarpur", "name": "Badarpur", "name_hi": "बदरपुर", "lat": 28.493, "lon": 77.303, "elevation_m": null},
    {"id": "mayur-vihar", "name": "Mayur Vihar", "name_hi": "मयूर विहार", "lat": 28.604, "lon": 77.289, "elevation_m": null},
    {"id": "laxmi-nagar", "name": "Laxmi Nagar", "name_hi": "लक्ष्मी नगर", "lat": 28.63, "lon": 77.277, "elevation_m": null},
    {"id": "preet-vihar", "name": "Preet Vihar", "name_hi": "प्रीत विहार", "lat": 28.641, "lon": 77.295, "elevation_m": null},
    {"id": "anand-vihar", "name": "Anand Vihar", "name_hi": "आनंद विहार", "lat": 28.647, "lon": 77.316, "elevation_m": null},
    {"id": "kondli", "name": "Kondli", "name_hi": "कोंडली", "lat": 28.618, "lon": 77.328, "elevation_m": null},
    {"id": "shahdara", "name": "Shahdara", "name_hi": "शाहदरा", "lat": 28.673, "lon": 77.29, "elevation_m": null},
    {"id": "seelampur", "name": "Seelampur", "name_hi": "सीलमपुर", "lat": 28.67, "lon": 77.271, "elevation_m": null},
    {"id": "yamuna-vihar", "name": "Yamuna Vihar", "name_hi": "यमुना विहार", "lat": 28.7, "lon": 77.275, "elevation_m": null},
    {"id": "karawal-nagar", "name": "Karawal Nagar", "name_hi": "करावल नगर", "lat": 28.732, "lon": 77.278, "elevation_m": null},
    {"id": "dilshad-garden", "name": "Dilshad Garden", "name_hi": "दिलशाद गार्डन", "lat": 28.68, "lon": 77.32, "elevation_m": null},
    {"id": "noida", "name": "Noida", "name_hi": "नोएडा", "lat": 28.57, "lon": 77.321, "elevation_m": null},
    {"id": "ghaziabad", "name": "Ghaziabad", "name_hi": "गाज़ियाबाद", "lat": 28.669, "lon": 77.454, "elevation_m": null},
    {"id": "gurugram", "name": "Gurugram", "name_hi": "गुरुग्राम", "lat": 28.495, "lon": 77.089, "elevation_m": null},
    {"id": "faridabad", "name": "Faridabad", "name_hi": "फ़रीदाबाद", "lat": 28.408, "lon": 77.318, "elevation_m": null}
  ]
}
